[
  {
    "id": "rbi.ucb-cyber.2026.incident-reporting-6h",
    "instrument_id": "rbi.ucb-cyber.2026",
    "paragraph_ref": "Paragraph 88",
    "text_verbatim": "88. The UCB shall report cyber incidents within six hours of detection on DAKSH \nplatform (Reserve Bank’s Advanced Supervisory Monitoring System - \nhttps://daksh.rbi.org.in).",
    "normalized": {
      "actor": [
        "ucb"
      ],
      "trigger": {
        "type": "event",
        "description": "A cyber incident is detected"
      },
      "action": "Report the cyber incident on RBI's DAKSH platform within six hours of detection.",
      "deadline": {
        "calendar": "continuous",
        "kind": "relative",
        "duration_iso8601": "PT6H",
        "anchor": "detection"
      },
      "recipient": "RBI via DAKSH (https://daksh.rbi.org.in)"
    },
    "applicability": {
      "entity_classes": [
        "ucb"
      ],
      "conditions": [
        "Entity is covered by the UCB Direction",
        "Event is a cyber incident as the Direction defines it"
      ],
      "requires": [
        "rbi_cyber_incident"
      ]
    },
    "validity": {
      "valid_from": "2026-07-31",
      "valid_to": null,
      "recorded_at": "2026-10-04T00:00:00Z"
    },
    "status": "in_force",
    "citations": [
      {
        "instrument_id": "rbi.ucb-cyber.2026",
        "paragraph_ref": "Paragraph 88",
        "page": 29,
        "char_start": 55873,
        "char_end": 56047,
        "excerpt_verbatim": "88. The UCB shall report cyber incidents within six hours of detection on DAKSH \nplatform (Reserve Bank’s Advanced Supervisory Monitoring System - \nhttps://daksh.rbi.org.in).",
        "source_sha256": "c0225a9b1eed70d2900dd81eaeab7ec5be5e9574e64e84edbb7a33f434b593f9"
      }
    ],
    "extraction": {
      "method": "manual",
      "model": null,
      "prompt_version": null,
      "extractor_version": "0.1.0"
    },
    "verification": "machine_checked",
    "verification_details": {
      "reviewer": "AI reviewer agent (span located in the stored RBI text, page from page_offsets)",
      "date": "2026-10-04"
    },
    "confidence": 1.0,
    "confidence_reason": "Text is explicit on actor, duration, starting event and channel. Paragraph 4 puts Chapter III (reporting) on every UCB and Chapter IV (VA / PT) on Levels II to IV."
  },
  {
    "id": "rbi.ucb-cyber.2026.cert-in-notification",
    "instrument_id": "rbi.ucb-cyber.2026",
    "paragraph_ref": "Paragraph 87, second sentence",
    "text_verbatim": "The UCB \nshall also proactively notify CERT-In regarding cyber incidents.",
    "normalized": {
      "actor": [
        "ucb"
      ],
      "trigger": {
        "type": "event",
        "description": "A cyber incident occurs"
      },
      "action": "Pro-actively notify Indian Computer Emergency Response Team (CERT-In) regarding the cyber incident.",
      "deadline": {
        "calendar": "continuous",
        "kind": "none",
        "duration_iso8601": null,
        "anchor": "not_applicable"
      },
      "recipient": "Indian Computer Emergency Response Team (CERT-In)"
    },
    "applicability": {
      "entity_classes": [
        "ucb"
      ],
      "conditions": [
        "Entity is covered by the UCB Direction",
        "Event is a cyber incident as the Direction defines it"
      ],
      "requires": [
        "rbi_cyber_incident"
      ]
    },
    "validity": {
      "valid_from": "2026-07-31",
      "valid_to": null,
      "recorded_at": "2026-10-04T00:00:00Z"
    },
    "status": "in_force",
    "citations": [
      {
        "instrument_id": "rbi.ucb-cyber.2026",
        "paragraph_ref": "Paragraph 87, second sentence",
        "page": 29,
        "char_start": 55798,
        "char_end": 55871,
        "excerpt_verbatim": "The UCB \nshall also proactively notify CERT-In regarding cyber incidents.",
        "source_sha256": "c0225a9b1eed70d2900dd81eaeab7ec5be5e9574e64e84edbb7a33f434b593f9"
      }
    ],
    "extraction": {
      "method": "manual",
      "model": null,
      "prompt_version": null,
      "extractor_version": "0.1.0"
    },
    "verification": "machine_checked",
    "verification_details": {
      "reviewer": "AI reviewer agent (span located in the stored RBI text, page from page_offsets)",
      "date": "2026-10-04"
    },
    "confidence": 1.0,
    "confidence_reason": "The sentence states a duty with no time limit or channel; modelled as applicable with no computed deadline. CERT-In's own six-hour duty is separate. Paragraph 4 puts Chapter III (reporting) on every UCB and Chapter IV (VA / PT) on Levels II to IV."
  },
  {
    "id": "rbi.ucb-cyber.2026.va-half-yearly",
    "instrument_id": "rbi.ucb-cyber.2026",
    "paragraph_ref": "Paragraph 116 (VA)",
    "text_verbatim": "116. The UCB shall periodically conduct VA / PT of internet facing web / mobile \napplications, servers, and network components throughout their lifecycle (pre-\nimplementation, post implementation, and after changes). VA of critical \napplications and those on DMZ shall be conducted at least once in every six \nmonths. PT shall be conducted at least once in a year.",
    "normalized": {
      "actor": [
        "ucb.level_ii",
        "ucb.level_iii",
        "ucb.level_iv"
      ],
      "trigger": {
        "type": "periodic",
        "description": "Recurring"
      },
      "action": "Conduct VA of critical applications and those on DMZ at least once in every six months.",
      "deadline": {
        "calendar": "continuous",
        "kind": "recurring",
        "duration_iso8601": "P6M",
        "anchor": "not_applicable"
      }
    },
    "applicability": {
      "entity_classes": [
        "ucb.level_ii",
        "ucb.level_iii",
        "ucb.level_iv"
      ],
      "conditions": [
        "Entity is covered by the UCB Direction"
      ]
    },
    "validity": {
      "valid_from": "2026-07-31",
      "valid_to": null,
      "recorded_at": "2026-10-04T00:00:00Z"
    },
    "status": "in_force",
    "citations": [
      {
        "instrument_id": "rbi.ucb-cyber.2026",
        "paragraph_ref": "Paragraph 116 (VA)",
        "page": 33,
        "char_start": 63066,
        "char_end": 63430,
        "excerpt_verbatim": "116. The UCB shall periodically conduct VA / PT of internet facing web / mobile \napplications, servers, and network components throughout their lifecycle (pre-\nimplementation, post implementation, and after changes). VA of critical \napplications and those on DMZ shall be conducted at least once in every six \nmonths. PT shall be conducted at least once in a year.",
        "source_sha256": "c0225a9b1eed70d2900dd81eaeab7ec5be5e9574e64e84edbb7a33f434b593f9"
      }
    ],
    "extraction": {
      "method": "manual",
      "model": null,
      "prompt_version": null,
      "extractor_version": "0.1.0"
    },
    "verification": "machine_checked",
    "verification_details": {
      "reviewer": "AI reviewer agent (span located in the stored RBI text, page from page_offsets)",
      "date": "2026-10-04"
    },
    "confidence": 1.0,
    "confidence_reason": "Text states the minimum frequency. Which systems are critical is not evaluated. Paragraph 4 puts Chapter III (reporting) on every UCB and Chapter IV (VA / PT) on Levels II to IV."
  },
  {
    "id": "rbi.ucb-cyber.2026.pt-annual",
    "instrument_id": "rbi.ucb-cyber.2026",
    "paragraph_ref": "Paragraph 116 (PT)",
    "text_verbatim": "116. The UCB shall periodically conduct VA / PT of internet facing web / mobile \napplications, servers, and network components throughout their lifecycle (pre-\nimplementation, post implementation, and after changes). VA of critical \napplications and those on DMZ shall be conducted at least once in every six \nmonths. PT shall be conducted at least once in a year.",
    "normalized": {
      "actor": [
        "ucb.level_ii",
        "ucb.level_iii",
        "ucb.level_iv"
      ],
      "trigger": {
        "type": "periodic",
        "description": "Recurring"
      },
      "action": "Conduct PT at least once in a year.",
      "deadline": {
        "calendar": "continuous",
        "kind": "recurring",
        "duration_iso8601": "P12M",
        "anchor": "not_applicable"
      }
    },
    "applicability": {
      "entity_classes": [
        "ucb.level_ii",
        "ucb.level_iii",
        "ucb.level_iv"
      ],
      "conditions": [
        "Entity is covered by the UCB Direction"
      ]
    },
    "validity": {
      "valid_from": "2026-07-31",
      "valid_to": null,
      "recorded_at": "2026-10-04T00:00:00Z"
    },
    "status": "in_force",
    "citations": [
      {
        "instrument_id": "rbi.ucb-cyber.2026",
        "paragraph_ref": "Paragraph 116 (PT)",
        "page": 33,
        "char_start": 63066,
        "char_end": 63430,
        "excerpt_verbatim": "116. The UCB shall periodically conduct VA / PT of internet facing web / mobile \napplications, servers, and network components throughout their lifecycle (pre-\nimplementation, post implementation, and after changes). VA of critical \napplications and those on DMZ shall be conducted at least once in every six \nmonths. PT shall be conducted at least once in a year.",
        "source_sha256": "c0225a9b1eed70d2900dd81eaeab7ec5be5e9574e64e84edbb7a33f434b593f9"
      }
    ],
    "extraction": {
      "method": "manual",
      "model": null,
      "prompt_version": null,
      "extractor_version": "0.1.0"
    },
    "verification": "machine_checked",
    "verification_details": {
      "reviewer": "AI reviewer agent (span located in the stored RBI text, page from page_offsets)",
      "date": "2026-10-04"
    },
    "confidence": 1.0,
    "confidence_reason": "Text states the minimum frequency. Which systems are critical is not evaluated. Paragraph 4 puts Chapter III (reporting) on every UCB and Chapter IV (VA / PT) on Levels II to IV."
  }
]
