{
    "id":  "sebi.cscrf.2024.incident-reporting-6h",
    "instrument_id":  "sebi.cscrf.2024",
    "paragraph_ref":  "RS.CO.S1 / Annexure-O Section B.1",
    "text_verbatim":  "1. Any cyber-attack, cybersecurity incident and/ or breach falling under CERT-In \nCybersecurity directions29 shall be notified to SEBI and CERT-In within 6 hours of \nnoticing/ detecting such incidents or being brought to notice about such incidents. This \ninformation shall be shared with SEBI through the mkt_incidents@sebi.gov.in within \n6 hours. However, necessary details of the incidents shall be reported on SEBI Incident \nReporting Portal within 24 hours. Stock Brokers/ Depository Participants shall also \nreport the incidents to Stock Exchanges/ Depositories along with SEBI and CERT-In \nwithin 6 hours of noticing/ detecting such incidents or being brought to notice about such \nincidents. All other cybersecurity incident(s) shall be reported to SEBI, CERT-In and \nNCIIPC (as applicable) within 24 hours.",
    "normalized":  {
                       "actor":  [
                                     "sebi.mii",
                                     "sebi.qualified_re",
                                     "sebi.midsize_re",
                                     "sebi.small_re",
                                     "sebi.selfcert_re"
                                 ],
                       "trigger":  {
                                       "type":  "event",
                                       "description":  "Cyber-attack, cybersecurity incident and/or breach falling under CERT-In directions is noticed/detected or brought to notice"
                                   },
                       "action":  "Notify SEBI (via mkt_incidents@sebi.gov.in) and CERT-In within 6 hours of noticing/detecting or being brought to notice.",
                       "deadline":  {
                                        "kind":  "relative",
                                        "duration_iso8601":  "PT6H",
                                        "anchor":  "noticing",
                                        "alternative_anchors":  [
                                                                    "detection",
                                                                    "brought_to_notice"
                                                                ],
                                        "calendar":  "continuous",
                                        "fixed_date":  null
                                    },
                       "recipient":  "SEBI and CERT-In",
                       "evidence_required":  [
                                                 "Email notification record sent to mkt_incidents@sebi.gov.in",
                                                 "CERT-In incident submission receipt"
                                             ]
                   },
    "applicability":  {
                          "entity_classes":  [
                                                 "sebi.mii",
                                                 "sebi.qualified_re",
                                                 "sebi.midsize_re",
                                                 "sebi.small_re",
                                                 "sebi.selfcert_re"
                                             ],
                          "conditions":  [
                                             "Incident falls under CERT-In Cybersecurity directions",
                                             "Entity is a SEBI Regulated Entity"
                                         ],
                          "requires":  [
                                           "cert_in_annexure_i"
                                       ]
                      },
    "validity":  {
                     "valid_from":  "2024-08-20",
                     "valid_to":  null,
                     "recorded_at":  "2026-09-25T00:00:00Z"
                 },
    "status":  "in_force",
    "citations":  [
                      {
                          "instrument_id":  "sebi.cscrf.2024",
                          "paragraph_ref":  "RS.CO.S1",
                          "page":  123,
                          "char_start":  243670,
                          "char_end":  244485,
                          "excerpt_verbatim":  "1. Any cyber-attack, cybersecurity incident and/ or breach falling under CERT-In \nCybersecurity directions29 shall be notified to SEBI and CERT-In within 6 hours of \nnoticing/ detecting such incidents or being brought to notice about such incidents. This \ninformation shall be shared with SEBI through the mkt_incidents@sebi.gov.in within \n6 hours. However, necessary details of the incidents shall be reported on SEBI Incident \nReporting Portal within 24 hours. Stock Brokers/ Depository Participants shall also \nreport the incidents to Stock Exchanges/ Depositories along with SEBI and CERT-In \nwithin 6 hours of noticing/ detecting such incidents or being brought to notice about such \nincidents. All other cybersecurity incident(s) shall be reported to SEBI, CERT-In and \nNCIIPC (as applicable) within 24 hours.",
                          "source_sha256":  "bd9ddb68bb49b9a92771ff01ed3138e01f0962b383e9ff643008b729290fc85d"
                      }
                  ],
    "extraction":  {
                       "method":  "manual",
                       "model":  null,
                       "prompt_version":  null,
                       "extractor_version":  "0.1.0"
                   },
    "verification":  "machine_checked",
    "verification_details":  {
                                 "reviewer":  "antigravity-agent (AI; verified against SEBI CSCRF Circular 2024-08-20)",
                                 "date":  "2026-09-25"
                             },
    "confidence":  0.7,
    "confidence_reason":  "Conservative contested interpretation. Paragraph 17.1 states, \"For six categories of REs where cybersecurity and cyber resilience circular already exists - by January 01, 2025.\" Paragraph 17.2 states, \"For other REs where CSCRF is being issued for the first time - by April 01, 2025.\" (PDF page 9). Those are compliance glide-path dates; the previous model treated 2025-01-01 as a single in-force date. valid_from now uses the circular issue date, 2024-08-20, so the tool does not tell a user they owe less pending legal review."
}
