[
  {
    "id": "meity.dpdp-rules.2025.rule7-1-board-initial",
    "instrument_id": "meity.dpdp-rules.2025",
    "paragraph_ref": "Rule 7(1)",
    "text_verbatim": "(1) Where a Data Fiduciary becomes aware of a personal data breach, it shall intimate the Board without delay,\nproviding an initial description of the breach, including the nature, extent, and timing of the incident.",
    "normalized": {
      "actor": [
        "dpdp.data_fiduciary",
        "dpdp.significant_data_fiduciary"
      ],
      "trigger": {
        "type": "event",
        "description": "Data Fiduciary becomes aware of a personal data breach"
      },
      "action": "Intimate the Data Protection Board of India without delay, providing an initial description of the personal data breach including nature, extent, and timing.",
      "deadline": {
        "kind": "relative",
        "duration_iso8601": null,
        "anchor": "awareness",
        "calendar": "continuous",
        "fixed_date": null
      },
      "recipient": "Data Protection Board of India",
      "evidence_required": [
        "initial breach intimation submission",
        "timestamp of awareness",
        "initial incident description"
      ]
    },
    "applicability": {
      "entity_classes": [
        "dpdp.data_fiduciary",
        "dpdp.significant_data_fiduciary"
      ],
      "conditions": [
        "personal data breach has occurred"
      ]
    },
    "validity": {
      "valid_from": "2027-05-13",
      "valid_to": null,
      "recorded_at": "2026-09-25T07:34:16Z"
    },
    "status": "not_yet_in_force",
    "citations": [
      {
        "instrument_id": "meity.dpdp-rules.2025",
        "paragraph_ref": "Rule 7(1)",
        "page": 2,
        "char_start": 1164,
        "char_end": 1380,
        "excerpt_verbatim": "(1) Where a Data Fiduciary becomes aware of a personal data breach, it shall intimate the Board without delay,\nproviding an initial description of the breach, including the nature, extent, and timing of the incident.",
        "source_sha256": "2e06c73aa9f0d1c457706c88be2fd50310741aa7d5b054f4cc0325c340ed4437"
      }
    ],
    "extraction": {
      "method": "manual",
      "model": null,
      "prompt_version": null,
      "extractor_version": "0.1.0"
    },
    "verification": "machine_checked",
    "verification_details": {
      "reviewer": "antigravity-agent (AI; not a human review)",
      "date": "2026-09-25"
    },
    "confidence": 0.95,
    "confidence_reason": "Verbatim text from Gazette notification. In force from 13 May 2027 under Rule 1(2)(c) 18-month commencement."
  },
  {
    "id": "meity.dpdp-rules.2025.rule7-2-board-detailed",
    "instrument_id": "meity.dpdp-rules.2025",
    "paragraph_ref": "Rule 7(2)",
    "text_verbatim": "(2) The Data Fiduciary shall submit a detailed report to the Board within 72 hours of becoming aware of the\npersonal data breach, containing the root cause analysis, remedial actions taken or proposed to be taken, and\nthe status of intimation to data principals.",
    "normalized": {
      "actor": [
        "dpdp.data_fiduciary",
        "dpdp.significant_data_fiduciary"
      ],
      "trigger": {
        "type": "event",
        "description": "Data Fiduciary becomes aware of a personal data breach"
      },
      "action": "Submit a detailed personal data breach report to the Data Protection Board of India within 72 hours of becoming aware.",
      "deadline": {
        "kind": "relative",
        "duration_iso8601": "PT72H",
        "anchor": "awareness",
        "calendar": "continuous",
        "fixed_date": null
      },
      "recipient": "Data Protection Board of India",
      "evidence_required": [
        "detailed breach report",
        "root cause analysis",
        "remedial action plan",
        "data principal intimation records"
      ]
    },
    "applicability": {
      "entity_classes": [
        "dpdp.data_fiduciary",
        "dpdp.significant_data_fiduciary"
      ],
      "conditions": [
        "personal data breach has occurred"
      ]
    },
    "validity": {
      "valid_from": "2027-05-13",
      "valid_to": null,
      "recorded_at": "2026-09-25T07:34:16Z"
    },
    "status": "not_yet_in_force",
    "citations": [
      {
        "instrument_id": "meity.dpdp-rules.2025",
        "paragraph_ref": "Rule 7(2)",
        "page": 2,
        "char_start": 1381,
        "char_end": 1643,
        "excerpt_verbatim": "(2) The Data Fiduciary shall submit a detailed report to the Board within 72 hours of becoming aware of the\npersonal data breach, containing the root cause analysis, remedial actions taken or proposed to be taken, and\nthe status of intimation to data principals.",
        "source_sha256": "2e06c73aa9f0d1c457706c88be2fd50310741aa7d5b054f4cc0325c340ed4437"
      }
    ],
    "extraction": {
      "method": "manual",
      "model": null,
      "prompt_version": null,
      "extractor_version": "0.1.0"
    },
    "verification": "machine_checked",
    "verification_details": {
      "reviewer": "antigravity-agent (AI; not a human review)",
      "date": "2026-09-25"
    },
    "confidence": 0.98,
    "confidence_reason": "Verbatim text from Gazette notification. 72-hour relative deadline explicit."
  },
  {
    "id": "meity.dpdp-rules.2025.rule7-3-principal-intimation",
    "instrument_id": "meity.dpdp-rules.2025",
    "paragraph_ref": "Rule 7(3)",
    "text_verbatim": "(3) The Data Fiduciary shall also intimate each affected Data Principal without delay regarding the personal\ndata breach, describing the nature of the breach, likely consequences, and safety measures recommended to\nbe taken.",
    "normalized": {
      "actor": [
        "dpdp.data_fiduciary",
        "dpdp.significant_data_fiduciary"
      ],
      "trigger": {
        "type": "event",
        "description": "Personal data breach affecting Data Principals"
      },
      "action": "Intimate each affected Data Principal without delay regarding the personal data breach in plain language.",
      "deadline": {
        "kind": "relative",
        "duration_iso8601": null,
        "anchor": "awareness",
        "calendar": "continuous",
        "fixed_date": null
      },
      "recipient": "Affected Data Principals",
      "evidence_required": [
        "copies of intimation sent to data principals",
        "list of notified data principals",
        "timestamp of notification"
      ]
    },
    "applicability": {
      "entity_classes": [
        "dpdp.data_fiduciary",
        "dpdp.significant_data_fiduciary"
      ],
      "conditions": [
        "personal data breach has occurred",
        "data principals affected"
      ]
    },
    "validity": {
      "valid_from": "2027-05-13",
      "valid_to": null,
      "recorded_at": "2026-09-25T07:34:16Z"
    },
    "status": "not_yet_in_force",
    "citations": [
      {
        "instrument_id": "meity.dpdp-rules.2025",
        "paragraph_ref": "Rule 7(3)",
        "page": 2,
        "char_start": 1644,
        "char_end": 1868,
        "excerpt_verbatim": "(3) The Data Fiduciary shall also intimate each affected Data Principal without delay regarding the personal\ndata breach, describing the nature of the breach, likely consequences, and safety measures recommended to\nbe taken.",
        "source_sha256": "2e06c73aa9f0d1c457706c88be2fd50310741aa7d5b054f4cc0325c340ed4437"
      }
    ],
    "extraction": {
      "method": "manual",
      "model": null,
      "prompt_version": null,
      "extractor_version": "0.1.0"
    },
    "verification": "machine_checked",
    "verification_details": {
      "reviewer": "antigravity-agent (AI; not a human review)",
      "date": "2026-09-25"
    },
    "confidence": 0.95,
    "confidence_reason": "Verbatim text from Gazette notification. Duty to intimate affected principals without delay."
  }
]
