[
  {
    "id": "rbi.nbfc-cyber.2026.incident-reporting-6h",
    "instrument_id": "rbi.nbfc-cyber.2026",
    "paragraph_ref": "Paragraph 14",
    "text_verbatim": "Paragraph 14: Incident Reporting to RBI: All NBFCs in the Middle Layer, Upper Layer, and Top Layer shall\nmandatorily report all cyber security incidents to the Reserve Bank of India on the DAKSH supervisory\nmonitoring portal within 6 hours of detection or occurrence of such incident.",
    "normalized": {
      "actor": [
        "nbfc.middle_layer",
        "nbfc.upper_layer",
        "nbfc.top_layer"
      ],
      "trigger": {
        "type": "event",
        "description": "Cyber security incident is detected or occurs"
      },
      "action": "Report cyber security incident to the Reserve Bank of India on the DAKSH supervisory monitoring portal within 6 hours of detection or occurrence.",
      "deadline": {
        "kind": "relative",
        "duration_iso8601": "PT6H",
        "anchor": "detection",
        "alternative_anchors": [
          "occurrence"
        ],
        "calendar": "continuous",
        "fixed_date": null
      },
      "recipient": "Reserve Bank of India (DAKSH Portal)",
      "evidence_required": [
        "DAKSH incident submission confirmation",
        "incident detection timestamp log",
        "initial incident impact assessment"
      ]
    },
    "applicability": {
      "entity_classes": [
        "nbfc.middle_layer",
        "nbfc.upper_layer",
        "nbfc.top_layer"
      ],
      "conditions": [
        "cyber security incident affecting entity systems"
      ]
    },
    "validity": {
      "valid_from": "2026-07-31",
      "valid_to": null,
      "recorded_at": "2026-09-25T07:34:16Z"
    },
    "status": "in_force",
    "citations": [
      {
        "instrument_id": "rbi.nbfc-cyber.2026",
        "paragraph_ref": "Paragraph 14",
        "page": 1,
        "char_start": 391,
        "char_end": 675,
        "excerpt_verbatim": "Paragraph 14: Incident Reporting to RBI: All NBFCs in the Middle Layer, Upper Layer, and Top Layer shall\nmandatorily report all cyber security incidents to the Reserve Bank of India on the DAKSH supervisory\nmonitoring portal within 6 hours of detection or occurrence of such incident.",
        "source_sha256": "5a25828a3bb1d9753e30d59c812c97ac0ed13a9b4baaf98e7daf6943a9867532"
      }
    ],
    "extraction": {
      "method": "manual",
      "model": null,
      "prompt_version": null,
      "extractor_version": "0.1.0"
    },
    "verification": "machine_checked",
    "verification_details": {
      "reviewer": "antigravity-agent (AI; not a human review)",
      "date": "2026-09-25"
    },
    "confidence": 0.98,
    "confidence_reason": "Verbatim text from RBI NBFC Master Direction. 6-hour DAKSH reporting explicit for Middle/Upper/Top layer."
  },
  {
    "id": "rbi.nbfc-cyber.2026.vapt-cadence",
    "instrument_id": "rbi.nbfc-cyber.2026",
    "paragraph_ref": "Paragraph 22",
    "text_verbatim": "Paragraph 22: Vulnerability Assessment and Penetration Testing (VAPT): All covered NBFCs shall perform\nVulnerability Assessment (VA) of critical and customer-facing infrastructure at least once every six months, and\ncomprehensive Penetration Testing (PT) at least once every twelve months.",
    "normalized": {
      "actor": [
        "nbfc.middle_layer",
        "nbfc.upper_layer",
        "nbfc.top_layer"
      ],
      "trigger": {
        "type": "periodic",
        "description": "Ongoing periodic security testing cadence"
      },
      "action": "Perform Vulnerability Assessment (VA) of critical and customer-facing infrastructure at least once every 6 months, and comprehensive Penetration Testing (PT) at least once every 12 months.",
      "deadline": {
        "kind": "recurring",
        "duration_iso8601": "P6M",
        "anchor": "not_applicable",
        "calendar": "continuous",
        "fixed_date": null
      },
      "recipient": "Reserve Bank of India",
      "evidence_required": [
        "VAPT reports",
        "board review notes",
        "closure verification"
      ]
    },
    "applicability": {
      "entity_classes": [
        "nbfc.middle_layer",
        "nbfc.upper_layer",
        "nbfc.top_layer"
      ],
      "conditions": []
    },
    "validity": {
      "valid_from": "2026-07-31",
      "valid_to": null,
      "recorded_at": "2026-09-25T07:34:16Z"
    },
    "status": "in_force",
    "citations": [
      {
        "instrument_id": "rbi.nbfc-cyber.2026",
        "paragraph_ref": "Paragraph 22",
        "page": 1,
        "char_start": 676,
        "char_end": 965,
        "excerpt_verbatim": "Paragraph 22: Vulnerability Assessment and Penetration Testing (VAPT): All covered NBFCs shall perform\nVulnerability Assessment (VA) of critical and customer-facing infrastructure at least once every six months, and\ncomprehensive Penetration Testing (PT) at least once every twelve months.",
        "source_sha256": "5a25828a3bb1d9753e30d59c812c97ac0ed13a9b4baaf98e7daf6943a9867532"
      }
    ],
    "extraction": {
      "method": "manual",
      "model": null,
      "prompt_version": null,
      "extractor_version": "0.1.0"
    },
    "verification": "machine_checked",
    "verification_details": {
      "reviewer": "antigravity-agent (AI; not a human review)",
      "date": "2026-09-25"
    },
    "confidence": 0.95,
    "confidence_reason": "Verbatim text from RBI NBFC Master Direction. 6-month VA and 12-month PT cadence explicit."
  }
]
